PTSD,,mental health,2,,644000,21900,,"Probably helps to relieve symptoms of PTSD (nightmares, flashbacks, poor sleep etc). But, due to its known adverse psychological effects, its not recommended for PTSD.","Preclinical and clinical studies generally support the biological plausibility for cannabinoids’ potential therapeutic effects, but underscore heterogeneity in outcomes depending on dose, chemotype, and individual variation. Treatment outcome studies of whole plant marijuana and related cannabinoids on PTSD are limited and not methodologically rigorous, precluding conclusions about their potential therapeutic effects. Reported benefits for nightmares and sleep (particularly with synthetic cannabinoid nabilone) substantiate larger controlled trials to determine effectiveness and tolerability...nown risks of marijuana thus currently outweigh unknown benefits for PTSD. Although controlled research on marijuana and other cannabinoids’ effects on PTSD remains limited, rapid shifts in the legal landscape may now enable such studies, potentially opening new avenues in PTSD treatment research.'",http://onlinelibrary.wiley.com/doi/10.1002/da.22596/full,"
https://annals.org/aim/fullarticle/2648596/benefits-harms-plant-based-cannabis-posttraumatic-stress-disorder-systematic-review",,"Depression and Anxiety, Annals of Internal Medicine",
Rheumatoid Arthritis,,immune system,1,,396000,10500,CBD,Weak evidence that cannabis reduces arthritis pain. The side-effects seemed to outweigh any small reduction in pain. ,"There is currently weak evidence that oral nefopam, topical capsaicin and oromucosal cannabis are all superior to placebo in reducing pain in patients with RA. However, each agent is associated with a significant side effect profile. The confidence in our estimates is not strong given the difficulties with blinding, the small numbers of participants evaluated and the lack of adverse event data. In some patients, however, even a small degree of pain relief may be considered worthwhile. Until further research is available, given the relatively mild nature of the adverse events, capsaicin could be considered as an add-on therapy for patients with persistent local pain and inadequate response or intolerance to other treatments. Oral nefopam and oromucosal cannabis have more significant side effect profiles however and the potential harms seem to outweigh any modest benefit achieved.'",http://onlinelibrary.wiley.com/doi/10.1002/14651858.CD008921.pub2/full,https://link.springer.com/article/10.1007/s00482-015-0084-3,,"Cochrane, Der Schmerz",
Schizophrenia,,mental health,0,,439000,18000,CBD,"Does not seem to have antipsychotic properties. In fact, inconclusive evidence suggests a link between cannabis use and schizophrenia. ","Results are limited and inconclusive due to the small number and size of randomised controlled trials available and quality of data reporting within these trials [...] Currently evidence is insufficient to show cannabidiol has an antipsychotic effect.' In fact, cannabis use has been connected with schizophrenia, although whether the relationship is causal is still unknown. The largest study yet found evidence that those who are genetically predisposed to schizophrenia are more likely to take up marijuana use, not the other way around. However, the authors did not exclude the possibility of a cause and effect relationship.",http://onlinelibrary.wiley.com/doi/10.1002/14651858.CD004837.pub3/full,https://www.nature.com/articles/mp2016252,https://www.cambridge.org/core/journals/psychological-medicine/article/div-classtitleassessing-causality-in-associations-between-cannabis-use-and-schizophrenia-risk-a-two-sample-mendelian-randomization-studydiv/122D651C3670683DAEDDA33997417105; https://ajp.psychiatryonline.org/doi/abs/10.1176/appi.ajp.2017.17030325; https://www.nature.com/articles/s41593-018-0206-1,"Cochrane, Molecular Psychiatry, Psychological Medicine, American Journal of Psychiatry, Nature",
Senile Dementia,,neurological,1,,481000,16600,,No evidence of any beneficial effect.,This review finds no evidence that cannabinoids are effective in the improvement of disturbed behaviour in dementia or in the treatment of other symptoms of dementia. More randomized double-blind placebo controlled trials are needed to determine whether cannabinoids are clinically effective in the treatment of dementia.',http://onlinelibrary.wiley.com/doi/10.1002/14651858.CD007204.pub2/full,,,Cochrane,
Skin Cancer,,cancer,1,,515000,29800,,"Cannabis compound kill skin cancer cells in lab and mouse studies. No human trials, though. ","In vitro studies showed that activation of cannabinoid
receptors induced the apoptotic death of tumorigenic epidermal
cells, without affecting the nontransformed epidermal cells.
Administration of WIN-55,212-2 or the selective CB2 agonist JWH-
133 was shown to result in growth inhibition of malignant tumors in
nude mice (ref. 6 and references therein). Another study showed
that activation of these receptors decreased tumor growth,
angiogenesis and metastasis of melanomas in mice, and inhibited
proliferation via inhibition of Akt pathway and hypophosphorylation
of retinoblastoma in melanoma cells'",http://cancerres.aacrjournals.org/content/68/2/339.full-text.pdf,,,Cancer Research,
Stroke,,cardiovascular,0,,2760000,21300,,Numerous case reports & population studies show that cannabis use may trigger stroke. ,"There were 34 case reports on 64 patients. Most cases (81%) exhibited a temporal relationship between cannabis exposure and the index event. In 70%, the evaluation was sufficiently comprehensive to exclude other sources for stroke. About a quarter (22%) of patients had another stroke after subsequent re-exposure to cannabis. Finally, half of patients (50%) had concomitant stroke risk factors, most commonly tobacco (34%) and alcohol (11%) consumption. Many case reports support a causal link between cannabis and cerebrovascular events. This accords well with epidemiological and mechanistic research on the cerebrovascular effects of cannabis.",http://www.strokejournal.org/article/S1052-3057(10)00289-2/abstract,"
http://stroke.ahajournals.org/content/early/2015/02/19/STROKEAHA.115.008680","http://jnnp.bmj.com/content/76/3/435.short
http://www.jns-journal.com/article/S0022-510X(16)30066-1/abstract","BMJ, Journal of the Neurological Sciences, AHA, Journal of Stroke and Cerebrovascular Diseases",
Sturge-Weber Syndrome ,(SWS),"neurological, skin",2,y,3490,11,CBD,"A very small study saw reduced seizures and improved quality of life, with neglible side-effects.","Four subjects had data through Week 14; one of whom initially withdrew for lack of efficacy, but because of other benefits re-enrolled with a lower dose. Two subjects at Week 14 and three bilaterally brain involved subjects at last visit had greater than 50% seizure reduction, reported improved quality of life, and remain on CBD 63 to 80 weeks after starting drug. Three subjects reported mild side effects considered related to CBD. This study suggests that CBD may be well-tolerated as adjunctive medication for seizure management and provides initial data supporting further study of CBD in SWS patients.'

",http://www.sciencedirect.com/science/article/pii/S088789941730053X,,,Pediatric Neurology,
Tinnitus,,neurological,1,,400000,4700,,"Unclear. Has some impact on tinnitus, but it's unclear whether it makes the symptoms better or worse in humans.  ","The effects of Cannabis itself on tinnitus in humans and animals are still unclear. However, CB1 receptors do exist in the CN and they are functional. Although cannabinoids have been shown to exert anti-epileptic effects in many parts of the brain, the function of CB1 receptors in the circuitry of the DCN, at least, suggests that they might have the potential to facilitate increased excitation rather than inhibit it, which, if neuronal hyperactivity is part of the cause of tinnitus, might exacerbate tinnitus rather than relieve it. Along those lines, the only animal study of the effects of cannabinoid receptor agonists in tinnitus suggests that tinnitus might be aggravated [42]. Although another study showed that CB1 receptors were downregulated in the VCN in an animal model of tinnitus [30], it is not clear whether this might be part of the cause of tinnitusrelated neuronal hyperactivity or a compensatory response to it. Therefore, at this stage, it is very unclear whether cannabinoid drugs that activate the CB1 receptor would make tinnitus worse or better. Determining this will require a much greater understanding of the functional significance of the endocannabinoid system in the CN and elsewhere in the central auditory system.'",http://www.jscholaronline.org/full-text/JPDM/201/Cannabis-Cannabinoids-and-Tinnitus.php,,,Journal of Pharmacology and Drug Metabolism,
Tourette’s,,neurological,2,,124000,6950,,Tic reduction without hindering brain performance.,"In 2 small randomized, double-blind, placebo-controlled studies (one with 24 patients, but only 7 completed the trial, the other with 12 patients), oral THC reduced tics and 'did not impair neuropsychological performances...to the contrary, the authors even found a trend towards a significant improvement during and after therapy while evaluating immediate verbal memory span.'",http://www.sciencedirect.com/science/article/pii/S0378874106000821,,,Journal of Ethnopharmacology,
Trichotillomania,,mental health,2,,204000,1610,,Reducing hair-pulling in a small study of 12 women over 12 weeks. Promising but proper trials are needed. ,"This study, the first to examine a cannabinoid agonist in the treatment of trichotillomania, found that dronabinol demonstrated statistically significant reductions in trichotillomania symptoms, in the absence of negative cognitive effects. Pharmacological modulation of the cannabinoid system may prove useful in controlling a range of compulsive behaviors. Given the small sample and open-label design, however larger placebo-controlled studies incorporating cognitive measures are warranted.'",https://link.springer.com/article/10.1007/s00213-011-2347-8,,,Psychopharmacology,
Wilson's Disease,,eye health,1,,193000,18900,,"In a single case study, a Wilson's Disease patient improved on cannabis and worsened when he stopped taking them. But the worsening could have been due to cannabis withdrawal. Better, clinical trials needed. ","Our patient obtained significant clinical improvement of his dystonic symptomatology under the effects of [cannabis] sativa. This improvement could be explained as a consequence of activation of cannabinoid receptors in the basal ganglia. However, we cannot rule out the possible contribution of an incipient withdrawal syndrome to the clinical worsening of his generalized dystonia observed 24 hours after stopping marijuana intake, as he presented irritability...Although the report of an isolated case is merely anecdotal, we feel that the above findings afford grounds to encourage considering the use of cannabinoid agonists as a potential therapeutic option in the management of some forms of dystonia. Properly designed and powered studies are required to allow a statistically valid recommendation based on objective evidence.",,http://onlinelibrary.wiley.com/wol1/doi/10.1002/mds.20268/full,,Movement Disorders,