Fertility,,reproductive ,0,,639000,24900,,Reduces fertility in both men and women. That human fertility is so sensitive to cannabis suggests it may be a pathway for future fertility affecting medicines. ,"Mammalian conception is a complex process regulated by both sexual behavior and reproductive performance. Alcohol, marijuana and tobacco are among the main factors which affect negatively fertility in women and men. Several studies have demonstrated that marijuana impairs the male copulatory activity, and that smokers of this illegal drug show reduced fertility due, for instance, to decrease in sperm concentration, defective sperm function or alteration of sperm morphology...In conclusion, this review has presented the ECS in males, and its link with sex hormones in controlling fertility in invertebrates, mammals and humans. The detection of endocannabinoids, the presence of specific enzymes for their synthesis and degradation, and the identification of CB receptors in sperm cells and male tissues suggest a critical role for endocannabinoids in modulating sperm functions during fertilization, and open novel perspectives in their therapeutic exploitation for the treatment of male infertility.'",http://www.sciencedirect.com/science/article/pii/S0303720708000142,,,Molecular and Cellular Endocrinology,
Fibromyalgia,,neurological,1,,479000,4920,,No convincing evidence.,"We found no convincing, unbiased, high quality evidence suggesting that nabilone [synthetic cannabinoid] is of value in treating people with fibromyalgia. The tolerability of nabilone was low in people with fibromyalgia.'",http://onlinelibrary.wiley.com/doi/10.1002/14651858.CD011694.pub2/full,,,Cochrane,
Gastro Intestinal Reflux,,gastrointestinal ,1,,141000,17500,,Reduced symptoms in dog and ferret studies. ,"Two mechanisms involved in gastro-oesophageal reflux (GOR) disease are transient LOS relaxations and gastric acid production; both may be influenced by cannabinoid drugs. CB1 agonists inhibited LOS relaxation and GOR in dogs, and LOS relaxation in ferrets, through central and peripheral vagal mechanisms...Cannabinoids decrease acid production in rodents through activation of CB1 receptors on vagal efferents to gastric mucosa, not by direct effects on parietal cells. CB1 receptor activation is protective in animal models of gastric ulcers.'",http://gut.bmj.com/content/57/8/1140.full,,,BMJ,
Glaucoma,,eye health,3,,491000,12000,,"Definitely lowers eye pressure, but only temporarily (3-4hrs). Since Glaucoma is a long-term disease, a LOT of cannabis would be required to maintain low pressure levels. Also, cannabis might cause additional damage to the eye by restricting blood flow to the optic nerve. ","It has been definitively demonstrated, and widely appreciated, that smoking marijuana lowers IOP in both normal individuals and in those with glaucoma...Although marijuana does lower the IOP temporarily, IOP lowering is only one consideration in slowing the optic nerve damage of glaucoma. For instance, there is a growing body of evidence that inadequate blood supply to the optic nerve may contribute to glaucoma damage. Since marijuana given systemically is known to lower blood pressure, it is possible that such an effect could be deleterious to the optic nerve in glaucoma, possibly reducing or eliminating whatever beneficial effect that conferred by lowering IOP.'",http://www.americanglaucomasociety.net/patients/position_statements/marijuana_glaucoma,,,American Glaucoma Society,
Glioblastoma Multiforme,,cancer,1,,40400,2800,CBD,Cell studies have shown some promise. But human trials needed.,"we show that the combined administration of THC and temozolomide (TMZ; the benchmark agent for the management of GBM) exerts a strong antitumoral action in glioma xenografts, an effect that is also observed in tumors that are resistant to TMZ treatment...Administration of submaximal doses of THC and cannabidiol remarkably reduces the growth of glioma xenografts. Moreover, treatment with TMZ and submaximal doses of THC and CBD produced a strong antitumoral action in both TMZ-sensitive and TMZ-resistant tumors. Altogether, our findings support that the combined administration of TMZ and cannabinoids could be therapeutically exploited for the management of GBM.'",http://mct.aacrjournals.org/content/10/1/90.short,,,Molecular Cancer Therapeutics,
Hepatitis C,,infection,2,,504000,31500,CBD,Study of 71 patients showed cannabis reducing the side effects of harsh conventional treatment. No evidence that it affects the virus  itself. ,"Seventeen of the 71 study patients (24%) discontinued therapy early, one cannabis user (5%) and 16 non-users (33%) (P=0.01). Overall, 37 patients (52%) were end-of-treatment responders, 14 (64%) cannabis users and 23 (47%) non-users (P=0.21). A total of 21 out of 71 (30%) had a sustained virological response: 12 of the 22 cannabis users (54%) and nine of the 49 non-users (18%) (P=0.009), corresponding to a post-treatment virological relapse rate of 14% in the cannabis users and 61% in the non-users (P=0.009). Overall, 48 (68%) were adherent, 29 (59%) non-users and 19 (86%) cannabis users (P=0.03). Although cannabis users were no more likely than non-users to take at least 80% of the prescribed interferon or ribavirin, they were significantly more likely to remain on HCV treatment for at least 80% of the projected treatment duration, 95 versus 67% (P=0.01). Our results suggest that modest cannabis use may offer symptomatic and virological benefit to some patients undergoing HCV treatment by helping them maintain adherence to the challenging medication regimen.",https://www.ncbi.nlm.nih.gov/pubmed/16957511,,,European Journal of Gastroenterology & Hepatology,
Hiccups,,neurological,1,,326000,1680,,An old case study in The Lancet (1998) suggested that smoking cannabis stopped intractable hiccups when other medications and procedures had failed. No controlled trials have ever been conducted. ,"Chlorpromazine controlled the hiccups only during sleep. Oral nifedipine, valproate, lansoprazole, and intravenous lidocaine had no effect. Glabellar acupuncture on day six and nine terminated the hiccups for less than an hour. Removal of a hair from the tympanic membrane on day 8 and irrigation of marcaine into the external auditory canal on day nine gave only brief relief. On day eight the patient, who had not smoked marijuana before, smoked marijuana, and his hiccups stopped. They recurred on day nine and on day ten the patient again smoked marijuana; hiccups stopped immediately and did not recur.'",http://www.sciencedirect.com/science/article/pii/S0140673605782702,,,The Lancet,
HIV related inflammation,HIV-associated systemic inflammation and immune activation,general health,1,,172000,8390,,"Only vague, anecedotal evidence.","While the clinical implications are unclear, our findings suggest that cannabis use is associated with a potentially beneficial reduction in systemic inflammation and immune activation in the context of antiretroviral-treated HIV infection.",https://academic.oup.com/cid/advance-article-abstract/doi/10.1093/cid/cix1116/4869752?redirectedFrom=fulltext#,,,Clinical Infectious Diseases,http://www.mdmag.com/medical-news/cannabis-associated-with-immune-cell-frequency-reduction-in-arttreated-hiv-patients
HIV-related neuropathy,,general health,2,,172000,8390,,Smoking cannabis is much more effective than placebo in reducing sensory neuropathy pain and other symptoms. ,"Smoked cannabis was reported to be superior to placebo in reducing DDS [a pain scale] from baseline to end of treatment day five in the PP population.' The review did not state whether cannabis was more or less effective than conventional pain medication. In one of the two studies, many of the participants were unintentionally 'unblinded', i.e. they realised they were smoking cannabis rather than a placebo cigarette, undermining the quality of the study. ",http://journals.plos.org/plosone/article?id=10.1371/journal.pone.0014433,,,PLoS ONE,
Huntington's Disease,,neurological,1,y,105000,13100,CBD,Appears to slow disease progression in rats. No human studies.,"this study provides preclinical evidence in support of a beneficial effect of the cannabis-based medicine Sativex as a neuroprotective agent capable of delaying disease progression in HD, a disorder that is currently poorly managed in the clinic, prompting an urgent need for clinical trials with agents showing positive results in preclinical studies.'",http://onlinelibrary.wiley.com/doi/10.1002/jnr.22682/full,,,Journal of Neuroscience Research,
Hypertension,,cardiovascular,1,,530000,32300,,Studies on rats and mice found that a certain cannabis compound (AEA) was effective against hypertension when injected. ,"AEA was shown to be involved in the regulation of hypertension. Intravenous AEA injection to rats and mice leads to a characteristic, triphasic response of the cardiovascular system...an immediate transient decrease in heart rate and cardiac contractility accompanied by a fall in blood pressure...AEA acts on calcium channels located in the vascular intima and on the specific TRPV1 receptors...a more prolonged decrease in blood pressure accompanied by a marked decrease in cardiac contractility and a slight decrease in total peripheral resistance occurs...Detailed studies demonstrated that only AEA influences the cardiovascular system in such a complex manner.'
",https://www.ncbi.nlm.nih.gov/pubmed/24781727,,,Journal of Physiology and Pharmacology,
Idiopathic Intracranial Hypertension,"Benign Intracranial Hypertension (BIH), Pseudotumor Cerebri (PTC)",neurological,1,,61300,5520,,In a single ancedotal case study the patient claimed that cannabis treatment resolved the condition.,"A case is presented in which a woman diagnosed with a longstanding history of idiopathic intracranial hypertension reported improvement of frontal headaches, photophobia, transient blindness, enlarged blind spots, and tinnitus after smoking marijuana. All these symptoms and signs were associated with increased intracranial pressure (220–425 mm of water). Treatment with dronabinol at a dose of 10 mg twice a day, then reduced to 5 mg twice a day, relieved all of her symptoms. Previously noted papilledema and enlargement of blind spots also resolved, and this, in the absence of psychoactive effect or weight gain.'",http://online.liebertpub.com/doi/abs/10.1089/jop.2006.22.68,,,Journal of Ocular Pharmacology and Therapeutics,
Inflammatory Bowel Disease (IBD),,gastrointestinal ,3,y,646000,986,,Animal studies suggests cannabis compounds (cannabinoids) reduce inflammation. Humans anecdotally report that their symptoms improve with smoking marijuana. Full trials now needed. ,"Patients with inflammatory bowel disease (IBD) anecdotally report symptom relief from smoking marijuana...In well-established models of IBD in rodents...several lines of evidence suggest endocannabinoids may limit intestinal inflammation in vivo...Cannabinoid agonists may also reduce motility in the inflamed intestine...In summary, cannabinoids reduce response to gut inflammation via CB1 and/or CB2 activation by direct suppression of proinflammatory mediators, inhibition of intestinal motility and diarrhoea, and attenuation of visceral sensitivity.'

",http://gut.bmj.com/content/57/8/1140.full,,,BMJ,
Insomnia,,general health,5,,521000,23400,CBD,"Large studies have shown that cannabis compounds improve sleep quality, particularly in patients who suffer from chronic conditions that have sleep-disrupting symptoms (e.g. pain). ","Cannabis sativa L. has been utilized for treatment of pain and sleep disorders since ancient times. This review examines modern studies on effects of Δ9-tetrahydrocannabinol (THC) and cannabidiol (CBD) on sleep...Experience to date with Sativex in numerous Phase I–III studies in 2000 subjects with 1000 patient years of exposure demonstrate marked improvement in subjective sleep parameters in patients with a wide variety of pain conditions including multiple sclerosis, peripheral neuropathic pain, intractable cancer pain, and rheumatoid arthritis, with an acceptable adverse event profile. No tolerance to the benefit of Sativex on pain or sleep, nor need for dosage increases have been noted in safety extension studies of up to four years, wherein 40–50% of subjects attained good or very good sleep quality, a key source of disability in chronic pain syndromes that may contribute to patients' quality of life.'",http://onlinelibrary.wiley.com/doi/10.1002/cbdv.200790150/full,,,Chemistry and Biodiversity,
Leukemia,,cancer,1,,433000,18300,CBD,Only cell studies. No human trials.,"Two non-psychotropic cannabinoids, cannabidiol (CBD) and cannabidiol-dimethylheptyl (CBD-DMH), induced apoptosis in a human acute myeloid leukemia (AML) HL-60 cell line. Apoptosis was determined by staining with bisBenzimide and propidium iodide. A dose dependent increase of apoptosis was noted, reaching 61 and 43% with 8 μg/ml CBD and 15 μg/ml CBD-DMH, respectively, after a 24 h treatment. Prior exposure of the cells to γ-irradiation (800 cGy) markedly enhanced apoptosis, reaching values of 93 and 95%, respectively. Human monocytes from normal individuals were resistant to either cannabinoids or γ-irradiation. Caspase-3 activation was observed after the cannabinoid treatment, and may represent a mechanism for the apoptosis. Our data suggest a possible new approach to treatment of AML.'",http://www.tandfonline.com/doi/abs/10.1080/1042819031000103917,,,Leukemia & Lymphoma,
Libido,,reproductive ,1,,902000,14500,,"Cannabis users have 20% more sex, but no evidence it's the cannabis that's causing the uplift.","In a study of 50,000 Americans of reproductive age, it was found that cannabis users have 20% more sex. This applied to people of all genders, age groups, health backgrounds etc. Authors suggest there might be a connection between cannabis and stimulation pathways. However, there is no evidence of causation at this stage.",http://www.jsm.jsexmed.org/article/S1743-6095(17)31417-0/fulltext,,,The Journal of Sexual Medicine,
Lung Cancer,,cancer,1,,533000,29500,,THC inhibits tumour growth in certain types of lung cancer. Human trials are needed. ,"THC inhibited EGF-induced growth, chemotaxis and chemoinvasion. Moreover, signaling studies indicated that THC may act by inhibiting the EGF-induced phosphorylation of ERK1/2, JNK1/2 and AKT. THC also induced the phosphorylation of focal adhesion kinase at tyrosine 397. Additionally, in in vivo studies in severe combined immunodeficient mice, there was significant inhibition of the subcutaneous tumor growth and lung metastasis of A549 cells in THC-treated animals as compared to vehicle-treated controls. Tumor samples from THC-treated animals revealed antiproliferative and antiangiogenic effects of THC. Our study suggests that cannabinoids like THC should be explored as novel therapeutic molecules in controlling the growth and metastasis of certain lung cancers.'",http://www.nature.com/onc/journal/v27/n3/abs/1210641a.html,,,Oncogene,
Lymphoma,,cancer,1,,409000,14400,,Animal studies showed reduced tumours and spread and increased survival rates in mice. Human studies are needed. ,"Studies show that exposure of murine lymphoma tumors EL-4,
LSA, and P815 to D(9)-tetrahydrocannabinol in vitro led to a
significant reduction in cell viability and an increase in apoptosis,
and EL-4 tumor–bearing mice led to a significant reduction in
tumor load, increase in tumor-cell apoptosis, and increase
in survival of tumor-bearing mice...These data suggest that targeting CB1 and CB2 receptors by their agonists may have therapeutic potential for the treatment of
lymphoma.'",http://cancerres.aacrjournals.org/content/68/2/339.full-text.pdf,,,Cancer Research,
Malaria,,infection,1,,436000,12800,CBD,A single animal study showed cannabis protecting the brain from malaria-related damage.,CBD treatment resulted in an increase in BDNF expression in the hippocampus and decreased levels of proinflammatory cytokines in the hippocampus (TNF-α) and prefrontal cortex (IL-6). Our results indicate that CBD exhibits neuroprotective effects in CM model and might be useful as an adjunctive therapy to prevent neurological symptoms following this disease.',https://www.ncbi.nlm.nih.gov/pubmed/25595981,,,Neuroscience,
Meth addiction,,mental health,1,,321000,16800,,A single animal study showed cannabis protecting the brain from methamphetamine (meth)-related damage.,"although comorbid cannabis and METH use might worsen mental health problems in drug users, this study provides the first evidence that Δ9-THC reduces METH-induced brain damage via inhibition of striatal nNOS expression by both CB1-dependent and -independent mechanisms and of striatal and cortical astrocyte activation by CB1-independent mechanisms only.'",https://www.ncbi.nlm.nih.gov/pmc/articles/PMC4028295/,,,PLoS ONE,
Migraine,,neurological,2,y,453000,11300,CBD,"Can reduce cluster headache and migraine symptoms in some people. But large, high quality studies are lacking. ","Supporting literature suggests a role for medicinal cannabis and cannabinoids in several types of headache disorders including migraine and cluster headache, although it is primarily limited to case based, anecdotal, or laboratory-based scientific research...Cannabinoids appear to modulate and interact at many pathways inherent to migraine, triptan mechanisms ofaction, and opiate pathways, suggesting potential synergistic or similar benefits...Despite the limited evidence and research suggesting a role for cannabis and cannabinoids in some headache disorders, randomized clinical trials are lacking and necessary for confirmation and further evaluation.'",http://onlinelibrary.wiley.com/doi/10.1111/head.12570/full,,,Headache ,
Motion Sickness,,general health,1,,150000,17900,,Cannabis may mitigate motion sickness.,These findings demonstrate that stress and motion sickness in humans are associated with impaired endocannabinoid activity. Enhancing ECS signaling may represent an alternative therapeutic strategy for motion sickness in individuals who do not respond to currently available treatments.',http://journals.plos.org/plosone/article?id=10.1371/journal.pone.0010752,,,PLoS ONE,
Multiple Sclerosis (MS),,neurological,5,,4830000,8300,,"2 studies involving a total of 790 subjects showed positive results. Improved muscle spasms, pain, sleep quality, and mobility. Cannabis drug Sativex is approved for use in MS patients in 30 countries.","Review of 2 studies with a total of 790 subjects: 'they observed an objective improvement in mobility with oral THC and a subjective improvement in spasticity, muscle spasms, pain, sleep quality and general condition, as well as a decrease in hospitalizations for relapses with the two types of cannabinoids.' AND 'a statistically significant reduction in spasticity with the cannabis extract compared to placebo, a statistically significant subjective improvement in sleep quality with the cannabis extract compared to placebo; a statistically insignificant objective improvement in mobility and vesical dysfunction with the cannabis extract compared to placebo.' An oral spray, Sativex, has been approved for treating MS-associated spasticity in 30 countries.",http://www.sciencedirect.com/science/article/pii/S0378874106000821,,,Journal of Ethnopharmacology,https://www.theguardian.com/society/2018/jan/15/medical-marijuana-does-it-work-miracle-drug-evidence?CMP=Share_iOSApp_Other
Obesity,,general health,1,,570000,30800,,"Cannabis users appear less likely to be obese, but the reasons for this are not understood. ","Studies have shown that despite evidence that cannabis stimulates appetite, people who use cannabis are less likely to be obese than those who don't. However, the nature of this link is not understood, and hasn't been proven to be causal. Additionally, available studies are small or of low quality. ",https://academic.oup.com/aje/article/174/8/929/155851,https://www.tandfonline.com/doi/full/10.3109/00952990.2010.500438?src=recsys; https://www.sciencedirect.com/science/article/pii/S030698771300042X,,"Medical Hypotheses, American Journal of Epidemiology, Trends in Clinical Practice",
Osteoarthritis,,general health,2,,336000,8380,CBD,"May reduce osteoarthritis symptoms, but the studies are of poor quality & results are inconsistent. ","Two RCTs of 2 and 4 weeks duration respectively with nabilone, including 71 FMS patients, one 4-week trial with nabilone, including 30 spinal pain patients, and one 5-week study with tetrahydrocannbinol/cannabidiol, including 58 RA patients were included. One inclusion criterion was pain refractory to conventional treatment in three studies. No RCT with OA patients was found. The risk of bias was high for three studies. The findings of a superiority of cannabinoids over controls (placebo, amitriptyline) were not consistent. Cannabinoids were generally well tolerated despite some troublesome side effects and safe during the study duration. Currently, there is insufficient evidence for recommendation for any cannabinoid preparations for symptom management in patients with chronic pain associated with rheumatic diseases.'

",https://link.springer.com/article/10.1007/s00482-015-0084-3,,,Der Schmerz,
Pancreatic Cancer,,cancer,1,,352000,7070,,Cannabis compound shown reduced tumour growth in cell studies. But that's a long way from credible effects on humans.,"We show that cannabinoid receptors are expressed in human pancreatic tumor cell lines and tumor biopsies at much higher levels than in normal pancreatic tissue. Studies conducted with MiaPaCa2 and Panc1 cell lines showed that cannabinoid administration (a) induced apoptosis, (b) increased ceramide levels, and (c) up-regulated mRNA levels of the stress protein p8...Cannabinoids also reduced the growth of tumor cells in two animal models of pancreatic cancer. In addition, cannabinoid treatment inhibited the spreading of pancreatic tumor cells.'",http://cancerres.aacrjournals.org/content/66/13/6748.short,,,Cancer Research,
Parkinson’s,,neurological,1,,479000,19000,CBD,Did not improve the symptoms of Parkinson's Disease.,"In a review of 2 studies, it was found that 'oral administration of a cannabis extract (2.5 mg of THC and 1.25 mg of cannabidiol per capsule) resulted in no objective or subjective improvement in parkinsonism or dyskinesias.'",http://www.sciencedirect.com/science/article/pii/S0378874106000821,,,Journal of Ethnopharmacology,
Prostate Cancer,,cancer,1,,559000,17300,,Only very preliminary evidence.,"We have recently shown that the expression levels of both
cannabinoid receptors CB1 and CB2 are significantly higher in
human prostate cancer cells compared with normal prostate
epithelial cells. Based on this observation, LNCaP cells were treated
with WIN-55,212-2, which resulted in inhibition of cell growth and
induction of apoptosis...treated mice exhibited significant inhibition in the tumor growth with remarkable reduction of prostate-specific antigen secretion in
the serum'",http://cancerres.aacrjournals.org/content/68/2/339.full-text.pdf,,,Cancer Research,
Prostatitis,,reproductive ,2,,133000,1610,,"Subjective, anecdotal evidence that it may improve mood, pain, muscle spasms & sleep in prostatitis patients, but not weakness, fatigue, numbness, urination or movement. Proper studies are required. ","Almost 50% of respondents reported using cannabis (clinic n = 49; online n = 89). Of the cannabis users, 36.8% of clinic and 75% of online respondents reported that it improved their symptoms. Most of the respondents (from the clinic and online groups) reported that cannabis improved their mood, pain, muscle spasms, and sleep. However, they did not note any improvements for weakness, fatigue, numbness, ambulation, and urination. Overall, the effectiveness of cannabis for CP/CPPS was “somewhat/very effective” (57% clinic; 63% online)...These are the first estimates in men suffering from CP/CPPS and suggest that while cannabis use is prevalent, its medical use and benefit are unknown. This is an understudied area and the benefit or hazard for cannabis use awaits further study.'",http://europepmc.org/articles/pmc4277530,,,Canadian Urological Association Journal,
Psoriasis,,skin,1,,88200,6880,,"Might help reduce symptoms of psoriasis by reducing keratin production, but we don't really understand how yet. ","Psoriasis is a common skin disorder characterized by hyper proliferation of keratinocytes. Although the exact pathophysiology of psoriasis is not entirely understood, immune system and its interaction with nervous system have been postulated and investigated as the underlying mechanism. The interaction between these two systems through cholinergic anti-inflammatory pathway and also endocannabinoid system, may suggest cannabinoids as potential addition to antipsoriatic armamentarium.'",http://www.ingentaconnect.com/content/ben/ccp/2016/00000011/00000002/art00010,,,Current Clinical Pharmacology,
